resource_name,matched_alias,label,article_topic_match,pmcid,paragraph_text
PDB,PDB,1,True,PMC12041471,The calcium-bound structure of TMEM16A (PDB ID: 5OYB) and the TMEM16A with the known pore-blocker 1PBC (PDB ID: 7ZK3) were used as protein receptors for molecular docking.
PDB,PDB,1,True,PMC12041471,The TMEM16A (PDB ID: 7ZK3) in complex with 1PBC was used as protein receptors for MD simulations.
PDB,PDB,1,True,PMC12041471,TMEM16A in both states obtained from the Protein Data Bank (PDB code: 5OYB 20 and 7ZK3 19 ) was used as a receptor.
PDB,PDB,1,True,PMC12102731,"Atomic coordinates and structure factors were deposited to Protein Data bank (PDB) under the accession codes: Nsp15‐E266Q‐P2 1 ( 9MRU ), Nsp15‐E266Q‐P6 3 ( 9MRY ), WT‐P2 1 ( 9MRW )."
PDB,PDB,1,True,PMC11896806,"The N-terminal domain sequence of C. albicans Als3 protein was derived from the crystal structure (PDB code: 4LE8), covering residues 18-316 [ 27 ]."
PDB,PDB,1,True,PMC11896806,"The first step, the PatchDock module, generates initial complex PDB files of receptor proteins and miniproteins, which have not yet been optimized for binding."
PDB,PDB,1,True,PMC11896806,"Because ESMFold resets the origin and orientation of the PDB file during prediction, we realigned the miniprotein PDB files with the original complex PDB files from the initial PatchDock results."
# PDB DONE

RGD,RGD,0,True,PMC12089016,Simultaneous targeting of RGD and FA receptors on breast carcinoma could improve the diagnostic outcome of breast cancer patients.
RGD,RGD,0,True,PMC12089016,"In this study, we have designed and synthesized an FA-RGD heteromeric targeting vector, with both RGD and FA motifs, in one single molecule for positron emission tomography (PET) diagnostic imaging of breast carcinoma."
RGD,RGD,0,True,PMC12089016,"Aoa-FA-RGD peptide conjugate was radiolabeled efficiently with [ 18 F]FDG, resulting in high labeling efficiency (≥ 85%)."
RGD,RGD,0,True,PMC12089016,The Aoa-FA-RGD peptide conjugate showed the nanomolar affinity (≤ 51 nM) to the TNBC MDA-MB-231 cell line.
RGD,RGD,0,True,PMC12089016,"In the MDA-MB-231 xenografts model, [ 18 F]FDG-Aoa-FA-RGD peptide conjugate exhibited efficient clearance from the blood and excretion predominantly by the renal pathway (~ 56% ID), possibly due to its hydrophilic nature."
RGD,RGD,0,True,PMC12104560,"To make these nanoparticles better at finding tumors, we added ARGD peptides to their surfaces."
RGD,RGD,0,True,PMC12104560,Our research showed that these RGD–MXene nanoconjugates have excellent targeting accuracy and can eradicate tumors very effectively.
RGD,RGD,0,True,PMC12104560,"RGD peptides, which bind to integrin α v β 3 , offer a promising avenue for selectively targeting tumor cells."
RGD,RGD,0,True,PMC12104560,"RGD peptides can bind to integrin receptors on the cell surface, and certain integrins identify RGD motifs in proteins and bind to these peptides, enabling cell adhesion and communication [ 25 ]."
RGD,RGD,0,True,PMC12104560,"The extracellular domain of integrin α v β 3 is bent or folded in the inactive state to prevent binding, whereas in the on state to which the RGD peptide is bound, the extracellular domain appears straight without being bent."
RGD,RGD,0,True,PMC12123436,The complex was conjugated with an integrin-targeting peptide c(RGDfC) to afford a tumour-targeting conjugate (1-RGD) for bioimaging and photoactivated therapy.
RGD,RGD,0,True,PMC12123436,An RGD-free analogue (2) was also prepared for comparison studies.
RGD,RGD,0,True,PMC12123436,"Interestingly, the IEDDA cycloaddition reaction of the S , S -tetrazine-containing conjugate 1-RGD and complex 2 with (1 R ,8 S ,9 s )-bicyclo[6.1.0]non-4-yn-9-ylmethanol (BCN-OH) led to significant emission enhancement."
RGD,RGD,0,True,PMC12048423,"Table 1 Primers used for construction of the recombinant PRRSV rGD-EGFP, rGD-mCherry, or rGD-mCherry-EGFP infectious clones Number Primer Sequence 1 EGFP-F ATGGTGAGCAAGGGCGAGGAGCT 2 EGFP-R TCACTTGTACAGCTCGTCCATGCC 3 7U-TRS6-EGFP-F ATTTAAAT GTTCCGCGGCAAC CCCT TTAACC AGAGTTTCAGCGGAACG ATGGTGAGCAAGGGCGAGGAGCTGTTC 4 7U-EGFP-R TGCCAGCCCA ACGCGT TCACTTGTACAGCTCGTCCATGC 5 GD-Fragment A-F TAAGGAGCAGT GTTTAAAC TGCTAGCCGCCAGCGG 6 GD-Fragment A-R AAATTCATGCTGAGGGTGATGCTGTGGCGCGGATCAGACG 7 GD-Fragment B-F ACGCGT TGGGCTGGCATTCTTTGGCACC 8 GD-Fragment B-R ATGCCCAGGT CGGACCG CGAGGAGGTGGAGATGCCA 9 mCherry-F ATGGTGAGCAAGGGCGAGGAGG 10 mCherry-R CTTGTACAGCTCGTCCATGCCGCC 11 12-mCherry-F CCTGAATTGAA ATTTAAAT ATGGTGAGCAAGGGCGAGGAGG 12 12-mCherry-TRS-R GGTTAAAGGGGTTGCCGCGGAAC ACGCGT TCACTTGTACAGCTCGTCCATGCCGCCGGT 13 GD-Fragment C-F CTGACTAAGGAGCAGT GTTTAAAC TGCTAGCCGCCAGCGG 14 GD-Fragment C-R ATTTAAATTTCAATTCAGGCCTAAAGTTGGTTCAATGACAGGGC 15 GD-Fragment D-F CGGCAACCCCTTTAACCAGAGTTTCAGCGGAACGATGAAATGGGGTCTATGCAAAGCC 16 GD-Fragment D-R ATGCCCAGGT CGGACCG CGAGGAGGTGGAGATGCCA 17 JD-EGFP-F CTGTTCACCGGGGTGGTGCCCAT 18 JD-EGFP-R AGTGATCCCGGCGGCGGTCACGAA 19 JD-mCherry-F ACATGGCCATCATCAAGGAGTTC 20 JD-mCherry-R ATGCCGCCGGTGGAGTGGCGGC Note: the bold position indicates the endonuclease recognition sequence; the underlined part indicates the homology arm sequence"
RGD,RGD,0,True,PMC12048423,"Primers used for construction of the recombinant PRRSV rGD-EGFP, rGD-mCherry, or rGD-mCherry-EGFP infectious clones"
RGD,RGD,0,True,PMC12048423,"The rescued virus was named rGD-EGFP, rGD-mCherry, and rGD-mCherry-EGFP, respectively."
RGD,RGD,0,True,PMC12048423,"rGD-EGFP, rGD-mCherry, rGD-mCherry-EGFP, or rGD were infected on MARC-145 cells for 36 h at a multiplicity of infection (MOI) of 1.0."
RGD,RGD,0,True,PMC12048423,PRRSV rGD served as a positive control.
RGD,RGD,0,True,PMC12103621,"For instance, integrin subtypes such as integrin αvβ6 and RGD-binding integrins like αvβ3 play distinct roles in cell-matrix adhesion and mechanotransduction 22 , 23 ."
RGD,RGD,0,True,PMC12103621,"Specifically, integrin αvβ6 requires a higher tension of approximately 200 pN to activate cell spreading 24 , a requirement that starkly contrasts with the lower, cell type-independent threshold of around 40 pN needed for RGD-binding integrins 25 ."

RGD,RGD,0,True,PMC12123436,"Unlike common iridium( iii ) complexes, excitation of conjugate 1-RGD and complex 2 resulted in weak emission and negligible singlet oxygen ( 1 O 2 ) generation due to the quenching effect of the tetrazine unit."
RGD,RGD,0,True,PMC12123436,"Upon continuous light irradiation, the S , S -tetrazine moiety in conjugate 1-RGD and complex 2 underwent efficient photodissociation, yielding thiocyanate (3) and amide (4) complexes as photoproducts with increased emission intensities and enhanced 1 O 2 generation efficiencies."
RGD,RGD,0,True,PMC12103621,When functionalized with two different subtype-specific peptidomimetic ligands—RGD for αvβ3 and RTDLDSLRT (referred to as RTD) for αvβ6—distinct cell migration patterns were observed after 4 days under various force application parameters.
RGD,RGD,0,True,PMC12103621,When functionalized with two different subtype-specific peptidomimetic ligands—RGD for αvβ3 and RTDLDSLRT (referred to as RTD) for αvβ6—distinct cell migration patterns were observed after 4 days under various force application parameters.
RGD,RGD,0,True,PMC12103621,"It has been reported that RGD concentrations ranging between 25 μM and 3.5 mM support 3D cell adhesion and spreading in 3D hydrogels 5 , 31 ."
RGD,RGD,0,True,PMC12047590,"The MPN@K6-RGD/OGP/Ang coating not only supported the early adhesion and migration, late osteogenesis and mineralization of BMSCs, but also promoted the adhesion, migration and vascularization of HUVECs."
RGD,RGD,0,True,PMC12047590,"The trifunctional peptide coating (MPN@K6 - RGD/OGP/Ang) constructed in this paper has a mild preparation process, is biologically safe, facilitates large-scale production, has a positive effect on bone tissue repair, and has a great potential for clinical application in orthopedic and dental implants."
RGD,RGD,0,True,PMC12047590,"For example, arginine-glycine-aspartate (RGD) has been widely used to enhance cell adhesion and migration [ 18 ]."
RGD,RGD,0,True,PMC12047590,"Furthermore, dual-peptides coatings were obtained with the help of the designed hexalysine (K6) linked OGP and RGD polypeptides with promoted osseointegration, comparing to single peptide functionalized implant [ 22 , 23 ]."
RGD,RGD,0,True,PMC12047590,"Herein, using the platform concept described above, we present K6 linked respectively with three distinct functional peptides onto the MPNs, including RGD peptide for cellular adhesion and migration, OGP peptide that promotes osteogenic differentiation of BMSCs, and the peptide SVVYGLR that promotes angiogenesis ( Scheme 1 a)."
RGD,RGD,0,True,PMC12019744,"On the one hand, the grafting of the RGD sequence into the hydrogel could significantly improve cell proliferation in this system; on the other hand, it led to an earlier appearance of DOX drug resistance."

RGD,RGD,1,True,PMC9777590,"The Rat Genome Database (RGD) created a COVID-19 Disease Portal to leverage information from the scientific literature."
RGD,RGD,1,True,PMC9777590,"Our analysis confirms the role of the immune system in COVID-19 pathogenesis as shown by substantial enrichment of immune system related Gene Ontology terms. The information in RGD's COVID-19 disease portal can generate new hypotheses to potentiate novel therapies and prevention of acute and long-term complications of COVID-19."
RGD,RGD,1,True,PMC6444380,"The Rat Genome Database (RGD) PhenoMiner tool has provided the first step in this effort by standardizing and integrating data from individual studies."
RGD,RGD,1,True,PMC6444380,"Our work, mainly utilizing data curated in RGD, involves the following key steps: (i) we developed a meta-analysis pipeline to automatically integrate data from heterogeneous sources and to produce expected ranges (standardized phenotype ranges) for different strains and phenotypes under different experimental conditions; (ii) we created tools to visualize expected ranges for individual strains and strain groups."
RGD,RGD,1,True,PMC6444380,"The RGD (rgd.mcw.edu) is the most comprehensive data repository and informatics platform for the laboratory rat (18). RGD curates and integrates data from published literature, individual research projects as well as the PhysGen Program for Genomic Application (19) and the NBRP Rat Phenome Project in Japan (14)."
RGD,RGD,1,True,PMC6444380,"To better curate and query comprehensive experimental data from heterogeneous data sources, RGD initiated the PhenoMiner project (https://rgd.mcw.edu/rgdweb/phenominer/home.jsp) (20). Video tutorials about how to effectively use this database are described on RGD website (https://rgd.mcw.edu/wg/home/rgd_rat_community_videos/rgd-tool-and-website-videos/), and updates on new tools were described in the accompanying paper by Wang et al. (20) in this issue."
RGD,RGD,1,True,PMC6444380,"Therefore, the motivation for our work is to take advantage of the substantial volume of quantitative phenotype data in the RGD to establish expected ranges for different rat strains."
RGD,RGD,1,True,PMC3882879,"The continued expansion and success of these ontologies has facilitated the integration of more than 60,000 records into the RGD PhenoMiner database. In addition, new applications of these ontologies, such as annotation of Quantitative Trait Loci (QTL), have been added at the sites actively using them, including RGD and the Animal QTL Database."
RGD,RGD,1,True,PMC3882879,"New terms and expansions to the ontologies continue to be added as a result of active curation efforts at RGD and the Animal QTL database."
RGD,RGD,1,True,PMC3882879,"These ontologies are freely available for download and use from the NCBO BioPortal website at http://bioportal.bioontology.org/ontologies/1583 (CMO), http://bioportal.bioontology.org/ontologies/1584 (MMO), and http://bioportal.bioontology.org/ontologies/1585 (XCO), or from the RGD ftp site at ftp://rgd.mcw.edu/pub/ontology/."
RGD,RGD,1,True,PMC3882879,"RGD has substantially expanded its use of the CMO, MMO, and XCO for integration of complex datasets in the PhenoMiner project."
RGD,RGD,1,True,PMC3882879,"Easy access to consolidated results across rat strains and experiments is now available in the RGD PhenoMiner tool [30]. Results for a single strain can be accessed directly in PhenoMiner or from the strain phenotype profile section, labelled “Phenotype Values via PhenoMiner”, on the RGD strain report page."
RGD,RGD,1,True,PMC3361058,"The authors would like to acknowledge the contributions of the RGD curation team at the Medical College of Wisconsin and the staff and informatics team at Washington University. This project is funded in part by R01HL094271, R01HL094286, and R01HL064541."
# RGD DONE

SGD,SGD,0,False,PMC12082818,"Patient demographics, preoperative laboratory measurements, and RRs were compared between patients with single-gland disease (SGD) versus multigland disease (MGD)."
SGD,SGD,0,False,PMC12082818,The predictive threshold for SGD was subsequently validated on the following cohort of 115 patients.
SGD,SGD,0,False,PMC12082818,"Of 2368 patients included, 1585 (66.9%) patients had SGD, and 783 (33.1%) had MGD."
SGD,SGD,0,False,PMC12082818,"Patients with SGD had higher median (IQR) RRs than the MGD group (0.8 [0.5-1.3] vs 0.4 [0.3-0.7], P <.001)."
SGD,SGD,0,False,PMC12082818,"After adjusting for age, preoperative calcium and PTH, reoperative parathyroidectomy, and gland weight, the RR was an independent predictor (OR 2.155, P <.001) of SGD."
SGD,SGD,0,False,PMC11937440,Submarine groundwater discharge (SGD) is a nutrient source to coastal waters.
SGD,SGD,0,False,PMC11937440,"However, most SGD estimates are restricted to a local scale and hardly distinguish contributions from fresh (FSGD) and recirculated (RSGD) SGD."
SGD,SGD,0,False,PMC11937440,"Here, we compiled data on radium/radon of groundwater ( n ~ 2000) and seawater ( n ~ 10,000) samples along ~18,000 km of China’s coastal seas to resolve large scale FSGD and RSGD and their associated nutrient loads."
SGD,SGD,0,False,PMC11937440,Nearshore-scale FSGD ( ~ 3.56 × 10 8 m 3 d −1 ) was only 2% of the total SGD but comparable to RSGD in terms of nutrient loads.
SGD,SGD,0,False,PMC11937440,"Despite large uncertainties quantified via Monte Carlo simulations, SGD was a dominant contributor to China’s coastal nutrient budgets, with dissolved inorganic nitrogen, phosphorus and silicate fluxes of ~395, 2.9, and 581 Gmol a −1 , respectively."
SGD,SGD,0,False,PMC11971587,This study sought to quantify uptake rates of non‐invasive prenatal screening for de novo single‐gene disorders (NIPS‐SGD) in pregnant subjects whose reproductive partner is of advanced paternal age (APA) and to determine individual parameters associated with higher test uptake rates.
SGD,SGD,0,False,PMC11971587,"A cross‐sectional study was performed of pregnant subjects who received prenatal genetic counseling at a mid‐size tertiary care center and were offered NIPS‐SGD for APA (defined as 45 or older at delivery) between June 1, 2017 and April 13, 2021."
SGD,SGD,0,False,PMC11971587,The outcome was measured as subjects who elected to do NIPS‐SGD versus subjects who declined.
SGD,SGD,0,False,PMC11971587,186 subjects were offered NIPS‐SGD and met inclusion criteria.
SGD,SGD,0,False,PMC11971587,AUC for the final regression model predicting NIPS‐SGD uptake was 0.79.
SGD,SGD,0,False,PMC12008763,"In this economic evaluation of a simulated cohort of adult patients in Singapore, LVAD's cost per quality-adjusted life-year gained was 106 458 in Singapore dollars (SGD; US $79 446) for inotrope-dependent patients and SGD 174 798 (US $130 446) for inotrope-independent patients, with 59% and 19% probabilities of attaining cost-effectiveness, respectively."
SGD,SGD,0,False,PMC12008763,Costs were estimated (in 2023 Singapore dollars [SGD]) using cohort billing data from 2017 to 2022 and National Heart Centre Singapore LVAD charges.
SGD,SGD,0,False,PMC12008763,"Health care costs, quality-adjusted life-years (QALYs), and incremental cost-effectiveness ratio (ICER) evaluated against a threshold of SGD 114 000 (US $85 075) per QALY gained."
SGD,SGD,0,False,PMC12008763,"In the base case analysis, LVAD yielded an additional 3.45 QALYs at an incremental cost of SGD 404 678 (US $301 999), producing an ICER of SGD 117 370 (US $87 590) per QALY gained for the transplant-ineligible population."
SGD,SGD,0,False,PMC12008763,"The ICER differed for inotrope-use subgroups at SGD 106 458 (US $79 446) per QALY gained for inotrope-dependent patients and SGD 174 798 (US $130 446) per QALY gained for inotrope-independent patients (with 59% and 19% probabilities, respectively, of attaining high value)."
SGD,SGD,0,True,PMC11088924,"SGD chromatin was prepared with recombinant yeast histone octamers at a high nucleosome density (histone-to-DNA ratio = 0.8) and incubated with the TF Reb1 and/or the indicated remodelers, leading to the formation of distinct nucleosome density profiles."
SGD,SGD,0,True,PMC11088924,This has been most clearly demonstrated in studies based on reconstitution of yeast chromatin with the salt gradient dialysis (SGD) method ( Figure 1B ) or histone chaperone-based chromatin assembly systems.
SGD,SGD,0,True,PMC11088924,"However, the incubation of SGD chromatin with yeast whole-cell extract and ATP does result in a typical in vivo -like nucleosome positioning pattern [ 35 ]."
SGD,SGD,0,True,PMC11013434,"In M. speciosa , a single protein localization assay in yeast revealed that MspSGD was localized in the nucleus and MspTHAS candidates were localized in the cytoplasm."
SGD,SGD,0,True,PMC11013434,"This may be required to promote the re-localization of the HpaTHAS gene towards the nucleus to interact with HpaSGD , as occurs at the protein level in M. speciosa [ 19 ] when expressed in yeast and C. roseus cells [ 16 ]."

SGD,SGD,1,True,PMC11556787,"Gene ( S. cerevisiae ) HRD1 Saccharomyces Genome Database (SGD) ( Wong et al., 2023 ) YOL013C"
SGD,SGD,1,True,PMC11556787,"Gene ( S. cerevisiae ) HRD3 Saccharomyces Genome Database (SGD) ( Wong et al., 2023 ) YLR207W"
SGD,SGD,1,True,PMC11556787,"Gene ( S. cerevisiae ) USA1 Saccharomyces Genome Database (SGD) ( Wong et al., 2023 ) YML029W"
SGD,SGD,1,True,PMC11556787,"Gene ( S. cerevisiae ) DER1 Saccharomyces Genome Database (SGD) ( Wong et al., 2023 ) YBR201W"
SGD,SGD,1,True,PMC11556787,"Gene ( S. cerevisiae ) YOS9 Saccharomyces Genome Database (SGD) ( Wong et al., 2023 ) YDR057W"
SGD,SGD,1,True,PMC11904613,"Therefore, we attempted to uncover genes within S. cerevisiae which may have a role in genome stability by screening the Saccharomyces Genome Database (SGD) for genes that are involved in DNA replication, meiosis, or decreased resistance to genotoxins."
SGD,SGD,1,True,PMC11545921,"“Mito” function in SGD description: Whether or not the Saccharomyces Genome Database description of the gene’s function includes the words “mitochondria”, “mitochondrial”, or “respiration”, or other closely related term (e.g., “oxidative phosphorylation” would be considered a closely-related term)."
SGD,SGD,1,True,PMC11701598,"To accommodate and curate these reference-orientated resource, the Saccharomyces Genome Database (SGD, https://www.yeastgenome.org ) ( 6 ) was developed >25 years ago and continued serving the yeast community ( 7 ), providing encyclopedic information regarding the genome, genes, proteins and other encoded features of S. cerevisiae ."
SGD,SGD,1,True,PMC11701598,"Compared with the classic yeast genomics databases such as SGD ( 6 ) and YGOB ( 11 ), ScRAPdb shines with its unique emphasis on population-scaled pangenome characterization and multi-omics integration."
SGD,SGD,1,True,PMC12081708,"This detailed information is sourced from the most recent comprehensive datasets available in the Saccharomyces Genome Database (SGD), which can be further explored at http://www.yeastgenome.org ."
SGD,SGD,1,True,PMC12081708,The process begins with obtaining GO annotations from the SGD for a given yeast dataset.
SGD,SGD,1,True,PMC11088543,SGD ( https://www.yeastgenome.org/ ) and BioGRID 4.4 ( https://thebiogrid.org/ ) were both initially examined for Prs/Prs interactions.
SGD,SGD,1,True,PMC11088543,SGD and BioGRID databases were systematically scrutinized by selecting interactions of yeast Prs with other Prs proteins and seemingly unrelated proteins.
SGD,SGD,1,True,PMC11704421,"All data about auxotrophic experiments were downloaded from The Saccharomyces Genome Database (SGD, https://www.yeastgenome.org/ )."
SGD,SGD,1,True,PMC10158836,"As one of the first model organism knowledgebases, Saccharomyces Genome Database (SGD) has been supporting the scientific research community since 1993."
