resource_name,matched_alias,label,article_topic_match,pmcid,paragraph_text
BAR,BAR,0,False,PMC12098720,"The entire test is carried out in the CI engine of irrigation water pumping systems under the distinct injection pressures of 210, 230, and 250 bar with respective loading conditions of 0%, 20%, 40%, 60%, 80%, and 100%."
BAR,BAR,0,False,PMC12098720,"The test used three injection pressures (210 bar, 230 bar, and 250 bar) with a constant compression ratio (16:1)."
BAR,BAR,0,False,PMC12098720,"Each experimental trial was conducted with a constant compression ratio of 16:1, a constant engine speed of 1500 rpm, and varying injection pressures of 210 bar baseline, 230 bar, and 250 bar at sequential engine loads of 0%, 20%, 40%, 60%, 80%, and 100%."
BAR,BAR,0,False,PMC12098720,"A mechanical stirrer is a laboratory magnetic device with a spinning magnetic field that quickly spins a stir bar immersed in a liquid, churning it."
BAR,BAR,0,False,PMC12112389,"BAR + FTI therapy synergistically extended the lifespan by 25%, surpassing the effects of either monotherapy."
BAR,BAR,0,False,PMC12112389,"Mechanistically, BAR decreased the SASP and inflammatory markers (e.g., IL-6 and PAI-1), complementing the progerin-targeting effects of FTI."
BAR,BAR,0,False,PMC12119943,"In the publication, “Medical Error: Using Storytelling and Reflection to Impact Resident Error Response Factors,” the Figure 3 y-axis middle bar and lower bar were incorrectly labeled."
BAR,BAR,0,False,PMC12101096,"Demographic data, inflammatory markers, echocardiographic parameters, and blood urea nitrogen-to-albumin ratio (BAR) values were compared."
BAR,BAR,0,False,PMC12101096,"Logistic regression identified independent risk factors, and ROC curve analysis assessed the predictive value of BAR."
BAR,BAR,0,False,PMC12101096,"Myocardial injury was associated with lower ejection fraction (EF), and elevated procalcitonin, lactate, and BAR levels ( P <0.05)."
BAR,BAR,0,True,PMC12106694,"In addition to S-BAR for FEM, the SSC platform is compatible with CMOS processes and can realize compact, integrated chips, such as wearable or implantable microacoustic sensors or actuators."
BAR,BAR,0,True,PMC12082900,"The genome length covered by ROH ranged from 347.5 Mb in MAR to 522.9 Mb in BAR. The other breeds had the following average values: HAF (494.9 Mb), MUR (372.3 Mb), and TPR (394.2 Mb). In Fig. 3, the average length (in kb) and number of ROH per breed are represented together through a scatter plot."
BAR,BAR,0,True,PMC12082900,"ROH islands were not uniformly distributed across the genome; in fact, 12 chromosomes out of the 31 contained ROH islands, with the following distribution: ECA2 (BAR), ECA3 (BAR, HAF, MUR, TPR), ECA6-7 (HAF), ECA8 (BAR, HAF), ECA10 (BAR, HAF), ECA11 (HAF), ECA13 (BAR), ECA15 (BAR, TPR), ECA16 (HAF), and ECA29 (BAR, TPR)."
BAR,BAR,0,True,PMC12125327,( A ) Elongated adventitious shoots were cultured in triple macroelement (3MS) medium supplemented with 0.1 mg/L BA and 0.01 mg/L NAA (bar = 1.18 cm) after 21 d; ( B ) Rooted of in vitro shoots in presence of 0.6 mg/L IBA after 21 d (bar = 1.50 cm); ( C ) Acclimatization regenerated plantlets transferred to nutrient soil after 30 d. (bar = 2.50 cm).
BAR,BAR,0,True,PMC12064776,Model TB: the implants were splinted with welded titanium bar; Model PB: the implants were splinted with PEEK (Poly Ether Ether Ketone) bar.
BAR,BAR,1,True,PMC11201900,"We generated transcriptome read mapping data and tissue images, which were then uploaded to the Bio-Analytic Resource for Plant Biology (BAR) database, resulting in a graphic expression atlas that can be easily accessed by inputting a query gene [24]."
BAR,BAR,1,True,PMC11201900,"The Cacao SCA eFP Browser (https://bar.utoronto.ca/efp_cacao_sca/cgi-bin/efpWeb.cgi) contains 4 views: a seed atlas, a meristem atlas, a developmental atlas, and a drought and diurnal atlas. The Cacao CCN-51 eFP Browser (https://bar.utoronto.ca/efp_cacao_ccn/cgi-bin/efpWeb.cgi) encompasses two views, a developmental atlas, and a drought and diurnal atlas. The Cacao TC eFP Browser (https://bar.utoronto.ca/efp_cacao_tc/cgi-bin/efpWeb.cgi) comprises two views, an Infected C stage Leaf Atlas (for Scavina6 and NA32 varieties [26], C stage leaves infected with Phytophtora megakarya for several timepoints) up to 72 hours (h) and a T. cacao Leaf Development Atlas (for Scavina6 and ICS-1 varieties, A-E stages leaves)."
BAR,BAR,1,True,38088205,"To make this data easily available as a resource for the community, all expression data is searchable in the Arabidopsis eFP Browser (https://bar.utoronto.ca/efp_arabidopsis/cgi-bin/efpWeb.cgi?dataSource=Gynoecium; Winter et al. 2007)."
BAR,BAR,1,True,PMC7212303,"Based on RNA-seq data from 17 samples, a tung tree electronic fluorescent pictographic (eFP) browser (http://bar.utoronto.ca/efp_tung_tree/cgi-bin/efpWeb.cgi) was devised to permit the visualization of gene expression patterns in “absolute”, “relative”, and “compare” modes in these tissues using the annotated gene IDs (File S3)."
BAR,BAR,1,True,38221855,"Researchers can conveniently access these resources through the interactive ePlant browser (https://bar.utoronto.ca/eplant_eucalyptus)."
BAR,BAR,1,True,PMC2633813,"To enable community-wide, simple, graphical representation of PopGenExpress transcript abundance data, a Web-based tool was devised, the Populus Electronic Fluorescent Pictograph (eFP) browser (Fig. 6; http://www.bar.utoronto.ca/efppop/cgi-bin/efpWeb.cgi). The Populus eFP browser is based on eFP tools for Arabidopsis and Mus musculus (Winter et al., 2007)."
BAR,BAR,1,True,PMC3846481,"The expression levels of all Eutrema genes in this study can be visualized using a “Eutrema eFP browser” at the Bio - Analytic Resource [40] (http://bar.utoronto.ca/efp_Eutrema/cgi-bin/efpWeb.cgi)."
BAR,BAR,1,True,PMC3846481,"This RNA-Seq data is publicly available and can be queried using the BAR eFP browser, which will facilitate the study of environment- or accession-associated differences in gene expression."


CIViC,CIViC,0,False,PMC12120376,"Confidence in institutions is a key predictor of civic honesty, yet evidence shows that this relationship varies across contexts and individuals."
CIViC,CIViC,0,False,PMC12120376,"We hypothesised that for individuals high in PDO, confidence in institutions could backfire and be linked to the rejection of civic honesty."
CIViC,CIViC,0,False,PMC12048768,"For Asian American young adults, along with other racially minoritized groups, it is possible that racial discrimination may heighten their awareness of social and racial inequities and subsequently inspire civic action (Wong et al., 2011 )."
CIViC,CIViC,0,False,PMC12048768,"The Sociopolitical Development Theory (Watts et al., 2003 ) argues that racial discrimination can strengthen understanding of racial injustice and encourage civic action from the affected individuals (Hope & Jagers, 2014 )."
CIViC,CIViC,0,False,PMC12048768,"For example, perceptions of inequity or experiences of discrimination increased involvement in civic activities among Asian Americans (Lui et al., 2022 ; Park et al., 2024 ; Wong et al., 2011 )."
CIViC,CIViC,0,False,PMC11920674,"Community‐level health partnerships are key not just for crisis response, but also for challenging divisive and exclusionary forms of citizenship, service delivery, and governance, and for building more just and emancipatory models of civic identity, social welfare, and state–society relations—health workers being potential agents of revolutionary change."
CIViC,CIViC,0,False,PMC11920674,"In a context where decades of conflict and structural violence had crystallised divisive and exclusionary models of civic identity, service delivery, and governance, new partnerships between former MoHS and ECBHO health workers were particularly significant."
CIViC,CIViC,0,False,PMC11920674,"It then details research findings, showing: how social welfare systems in Myanmar historically (re)produced divisive and exclusionary ideas of civic identity; how health workers from different systems have established new partnerships and solidarity since the 2021 coup; how experiences of and responses to suffering have been crucial to building solidarity and moral community; and how the latter has contributed to processes of revolutionary change by (re)shaping constructions of civic identity, social welfare, and governance ‘from below’."
CIViC,CIViC,0,False,PMC12076452,"GAS also correlated with significant societal benefits, including reduced harassment (OR = 0.693; P = 0.0078) and increased civic participation (OR = 1.339; P = 0.0005)."
CIViC,CIViC,0,True,PMC11951863,"Our results are consistent with similar studies that have examined the relationships between civic engagement and breast and cervical cancer screening, as well as religious service attendance and cancer screening ( Moudatsou et al., 2014 ; Hill et al., 2006 ; Salmoirago-Blotcher et al., 2011 )."
CIViC,CIViC,0,True,PMC11892607,"The development of the PCC NCRA went through a multistep process that started from the identification of key stakeholders in cancer research in the Philippines including representatives of national government agencies, specialty cancer centers and training institutions, academe and research institutions, civic society and professional organizations, and development partners."
CIViC,CIViC,0,True,PMC11840202,"In the Philippines, the National Cancer Research Agenda sought to diversify stakeholders in its design, including civic and professional organizations such as CARE Ph and CerviQ."
CIViC,CIViC,1,True,PMC12078457,"This study evaluates GPT-4o, Llama 3.1, and Qwen 2.5 in classifying genetic variants from the OncoKB and CIViC databases, as well as a real-world dataset derived from FoundationOne CDx reports."
CIViC,CIViC,1,True,PMC12078457,Stability analysis across 100 iterations revealed greater consistency with the CIViC system than with OncoKB.
CIViC,CIViC,1,True,PMC12078457,"This is exemplified by the OncoKB and CIViC databases, which rely on specialized committees and expert crowdsourcing, respectively 8 , 9 ."
CIViC,CIViC,1,True,PMC12078457,"We instructed the LLMs to classify genetic variants using the CIViC classification system, following the system prompts detailed in Supplementary Table 3 (Variant classification (CIViC level of evidence system)—Basic prompt)."
CIViC,CIViC,1,True,PMC12078457,"Other widely used frameworks include the ESMO Scale for Clinical Actionability of Molecular Targets (ESCAT), the OncoKB level of evidence classification, and the Clinical Interpretation of Variants in Cancer (CIViC) evidence levels 5 , 8 - 10 ."
CIViC,CIViC,1,True,PMC12034796,The statistics also indicate that RCT reports and registered trials cover a much higher number of populations and interventions than guidelines and CIViC because the integrated clinical trial data is not limited to cancer patients.
CIViC,CIViC,1,True,PMC12034796,"Interventions Interventions Therapies Total 129,119 5,631,219 1,543,754 6273 Unique CUIs 15,852 68,738 3994 418 Currently, the database includes (1) digital clinical guidelines extracted from the content management system (CMS) of the German Guideline Program in Oncology (GGPO), (2) abstracts and metadata of randomized controlled trials (RCTs) from PubMed , (3) registered clinical trials from ClinicalTrials.gov , as well as (4) curated assertions from CIViC , as a precision oncology knowledge base (POKB) for the clinical classification of cancer variants."
CIViC,CIViC,1,True,PMC12034796,"Alternatives to CIViC include OncoKB 49 , My Cancer Genome 50 , and Jax-Ckb 51 ."
CIViC,CIViC,1,True,PMC11762447,"Table 1 Differences between the individual MTBs in terms of structure and remuneration in the USA, Japan, Germany, Finland, Denmark and Italy USA Japan Germany Finland Denmark Italy Structure Decentralized, variable by institution Centralized, in large hospitals Integrated into the healthcare system National network of cancer centers Advisory, national network of cancer centers Regionalized, network of cancer centers Remuneration Private insurance, various models National health insurance, fixed fees Statutory health insurance, flat rates per case Public financing, uniform fees Public health insurance, fixed fees Regional health services, mixed financing Evidence levels – C-CAT levels NCT levels (Heidelberg, Augsburg) – Own ESCAT, OncoKB Tools cBioPortal ClinVar, OncoKB, gnomAD, COSMIC, CIViC cBioPortal/MIRACUM-Pipe (Augsburg, Freiburg), Knowledge Connector (Augsburg, Heidelberg) – Locally populated knowledge databases OncoKB Meetings Bi-monthly (MTB) Weekly Weekly Weekly (+ ad hoc) Bi-weekly/Weekly Weekly–monthly C-Cat center for cancer genomics and advanced therapeutics, NCT national center for tumor diseases, ESCAT european society for medical oncology scale for clinical actionability of molecular targets, COSMIC catalogue of somatic mutations in cancer, CIViC clinical interpretation of variants in cancer"
CIViC,CIViC,1,True,PMC11762447,"C-Cat center for cancer genomics and advanced therapeutics, NCT national center for tumor diseases, ESCAT european society for medical oncology scale for clinical actionability of molecular targets, COSMIC catalogue of somatic mutations in cancer, CIViC clinical interpretation of variants in cancer"
CIViC,CIViC,1,True,PMC11762447,"Table 3 An overview of knowledge databases including their access methods, updates, and the number of entries Database Developer/Institution Access Entries Maintenance OncoKB Memorial Sloan Kettering Cancer Center https://www.oncokb.org/ > 7500 variants Regular (06/2024) ClViC WUSM, St. Louis https://civicdb.org/ > 3500 variants Regular (06/2024) Ensembl EBI https://www.ensembl.org/ > 10 million variants (structural) Regular (05/2024) Reactome OICR, NYULMC, EMBL-EBI https://reactome.org/ > 2700 human pathways Regular (06/2024) My Cancer Genome Vanderbilt–Ingram Cancer Center https://www.mycancergenome.org/ > 16,800 biomarkers No update since 2021 TARGET Dana–Farber Cancer Institute Commercial platform > 135 manually curated genes Regular GDKD Fred Hutchinson Cancer Research Center, Seattle Not public > 700 gene–drug interactions Not updated since 2015 ClinVar NCBI https://www.ncbi.nlm.nih.gov/clinvar > 1.5 million variants Regular BRCA Exchange ENIGMA consortium https://brcaexchange.org/ > 27,400 BRCA 1/2 variants Regular (01/2024) GnomAD ExAC https://gnomad.broadinstitute.org/ > 730,947 exomes/ > 76,215 genomes Regular (05/2024) NCBI SNP Database NCBI https://www.ncbi.nlm.nih.gov/snp/ > 2 billion submitted SNP Regular WUSM Washington University School of Medicine, NCBI National Center for Biotechnology Information, EBI European Bioinformatics Institute, OICR Ontario Institute for Cancer Research, NYULMC New York University Langone Medical Center, EMBL European Molecular Biology Laboratory, ExAC Exome Aggregation Consortium"
CIViC,CIViC,1,True,PMC11762447,Clinical Interpretation of Variants in Cancer (CIViC) is an expert-led and crowd-sourced knowledge base that provides clinical interpretation of cancer variants developed and maintained by the Washington University School of Medicine St. Louis (WUSM).
CIViC,CIViC,1,True,PMC11762447,"as meta and data files (TSV) MIRACUM-Pipe: processing of aligned omics data variant calling, annotation/ analysis OncoKB CiVIC MyCancerGenome Visualization reports https://.cbioportal.org [ 70 , 71 ] KC SNVs, indel, CNV, SV, gSmVs, Fusion, RNA, etc."
CIViC,CIViC,1,True,PMC11566986,"Databases are separated into three categories described in methods (left column) Name of database Site Category 1 MyCancerGenome www.mycancergenome.org OncoKB www.oncokb.org/ VICC Variant Interpretation of Cancer Consortium https://search.cancervariants.org CIViC https://civicdb.org/welcome Personalized Cancer Therapy (MD Anderson) https://pct.mdanderson.org/ The Jackson Laboratory Clinical Knowledgebase (JAX) https://ckb.jax.org Catalog of Somatic Mutations in Cancer (COSMIC): Cancer gene census https://cancer.sanger.ac.uk/census Category 2 Precision Medicine Knowledgebase https://pmkb.weill.cornell.edu Molecular Match, Inc https://www.molecularmatch.com/solutions/mmportal-clinical-decision-support.html cBioPortal for cancer genomics https://www.cbioportal.org GCD Data Portal https://portal.gdc.cancer.gov/ BBG Lab - Cancer Genome Interpreter/Cancer Biomarker Database https://www.cancergenomeinterpreter.org/home and https://www.cancergenomeinterpreter.org/biomarkers Caterogy 3 Mitelman Database of Chromosome Aberrations and Gene Fusions in Cancer https://mitelmandatabase.isb-cgc.org/ Cancer Therapeutic Drug Portal https://portals.broadinstitute.org/ctrp.v2.1/ Cancer Cell Line Encyclopedia (CCLE) in Depmap Portal https://depmap.org/portal/ intOGen https://www.intogen.org/ DriverDBv4 http://driverdb.bioinfomics.org/ European Variation Archive https://www.ebi.ac.uk/eva GTEX portal https://gtexportal.org/home/gene DoCM and DGIdb http://docm.info and https://www.dgidb.org Tumor Portal http://www.tumorportal.org/ Genecards https://www.genecards.org Cancer Driver Log https://candl.osu.edu Genomics of drug sensitivity https://www.cancerrxgene.org/"
CIViC,CIViC,1,True,PMC11566986,"The consortium gathers data from several well-known sources focused on somatic variants in cancer, including CIViC, JAX-CKB, MMatch, OncoKB, and PMKB."
CIViC,CIViC,1,True,PMC11566986,Clinical Interpretation of Variants in Cancer (CIViC) ( https://civicdb.org/welcome ) is an open-source platform designed to provide a comprehensive resource for the clinical interpretation of cancer genome alterations hosted by Washington University [ 15 ].
CIViC,CIViC,1,True,PMC11566986,"The portal provides links to external resources like COSMIC (Catalogue of Somatic Mutations in Cancer) and CIViC (Clinical Interpretation of Variants in Cancer), which offer further information on clinical significance, targeted therapies, and other relevant data."
CIViC,CIViC,1,True,PMC11566986,"It also annotates alterations that serve as biomarkers for response to cancer therapies by integrating information from multiple databases, including OncoKB, the Cancer Biomarkers Database, the Variant Interpretation for Cancer Consortium (VICC), and CIViC."
CIViC,CIViC,1,True,PMC12012014,"Variant calling software Illumina BaseSpace sequence hub CLC genomics workbench partek flow Varsome clinical Customisable pipeline a ✔ ✔ ✔ ✖ Tertiary analysis (filtering, annotation, classification) Basic b ✖ ✔ ✔ ✔ Custom Database ✖ ✖ ✔ ✖ VEP ✖ ✖ ✔ ✖ SnpEff ✖ ✖ ✔ ✖ ACMG/AMP ✖ ✖ ✖ ✔ CADD ✖ ✖ ✖ ✔ cBioportal ✖ ✖ ✖ ✔ CIViC ✖ ✖ ✖ ✔ CKB ✖ ✖ ✖ ✔ ClinGen ✖ ✖ ✖ ✔ Clinvar ✖ ✖ ✖ ✔ COSMIC ✖ ✖ ✖ ✔ dbSNP ✖ ✖ ✖ ✔ FATHMM ✖ ✖ ✖ ✔ OMIM ✖ ✖ ✖ ✔ PharmGKB ✖ ✖ ✖ ✔ PMKB ✖ ✖ ✖ ✔ VEP, Variant Effect Predictor; SnpEff, SNP effect; ACMG, American College of Medical Genetics and Genomics; AMP, Association for Molecular Pathology; CADD, Combined Annotation Dependent Depletion; CIViC, Clinical Interpretation of Variants in Cancer; CKB, Clinical Knowledgebase; ClinGen, Clinical Genome Resource; Clinvar, Archive of interpretations of clinically relevant variants; COSMIC, Catalogue of Somatic Mutations in Cancer; dbSNP, Single Nucleotide Polymorphism database; FATHMM, Functional analysis through hidden Markov models; OMIM, Online Mendelian Inheritance in Man; PharmGKB, Pharmacogenomics Knowledge Base; PMKB, Precision Medicine Knowledge Base."
CIViC,CIViC,1,True,PMC12012014,"VEP, Variant Effect Predictor; SnpEff, SNP effect; ACMG, American College of Medical Genetics and Genomics; AMP, Association for Molecular Pathology; CADD, Combined Annotation Dependent Depletion; CIViC, Clinical Interpretation of Variants in Cancer; CKB, Clinical Knowledgebase; ClinGen, Clinical Genome Resource; Clinvar, Archive of interpretations of clinically relevant variants; COSMIC, Catalogue of Somatic Mutations in Cancer; dbSNP, Single Nucleotide Polymorphism database; FATHMM, Functional analysis through hidden Markov models; OMIM, Online Mendelian Inheritance in Man; PharmGKB, Pharmacogenomics Knowledge Base; PMKB, Precision Medicine Knowledge Base."

# CIViC DONE

PDB,PDB,0,False,PMC11843812,"In this study, we uncover the main changes inside the PdB driving the impact on health and well-being from the residents' perceptions in a neighbourhood of Barcelona."
PDB,PDB,0,False,PMC11843812,Most changes inside the PdB were perceived as positive for health by all the groups.
PDB,PDB,0,False,PMC11843812,"Pla de Barris (Neighbourhood Plan—hereinafter, PdB) is a council-led wide-ranging urban regeneration programme for the most vulnerable neighbourhoods of Barcelona city."
PDB,PDB,0,False,PMC11843812,"Studies have shown, on one side, that the PdB programme has improved sustainable local partnerships in the process of implementation; and on the other side, that has allowed improvements in specific health indicators (e.g."
PDB,PDB,0,False,PMC11843812,"However, these studies have failed to illuminate how and to which population group affected the changes driving by the PdB."
PDB,PDB,0,True,PMC11793806,"Additionally, we used ADFRsuite 1.03 to convert all processed small molecules and receptor proteins into the PDBQT format for docking with AutoDock Vina 1.2.3 docking."
PDB,PDB,0,True,PMC12041471,Both protein and drug were converted to the PDBQT files using AutoDock CrankPep package software 41 .
PDB,PDB,1,True,PMC11923696,"Lys868, Asp1046, Cys919, and Glu885 are recognized as the critical residues on the VEGFR2 kinase domain (PDB ID: 3EWH )."
PDB,PDB,1,True,PMC11923696,3D and 2D interaction diagrams of the campesterol with their acceptor VEGFR1 (PDB: 3HNG) and γ-sitosterol with their acceptor VEGFR1 (PDB-3HNG).
PDB,PDB,1,True,PMC12041471,"By binding to specific sites within the pore or near the extracellular vestibule, inhibitors like 1PBC (PDB ID: 7ZK3 19 ) obstruct the ion conduction pathway."
PDB,PDB,1,True,PMC11793806,"(C-F) Binding capacity of isorhamnetin and predicted hub regulatory targets, including NFE2L2 (PDB ID: 7X5E), VEGFR (PDB ID: 1FLT), ZNF24 (PDB ID: 3LHR), and ATM (PDB ID: 7SIC )."
PDB,PDB,1,True,PMC11873931,(A) Crystal structure of the bacterial helicase PcrA (PDB 3PJR ) bound to ATP (orange) and DNA (gray).
PDB,PDB,1,True,PMC11841048,"The asymmetric units of B a- (PDB: 7MTX ), Cj- (PDB: 5URQ ) and Clp IMPDH (PDB: 5UWX ) contained 8, 8, and 4 active sites, respectively."
PDB,PDB,1,True,PMC11841048,Green: A110 (PDB: 4MYA ); orange: C91 (PDB: 4MY9 ); deep blue: D67 (PDB: 4QM1 ); beige: P32 (PDB: 4MYX ); cyan: Q21 (PDB: 4MY8 ).
PDB,PDB,1,True,PMC11989890,Key interactions of compound 12 ( Figure 6 D and Figure 7 D) with SRC (PDB: 3F3V) include hydrogen bonding with an ylidene nitrogen atom in the hydrazone fragment (negatively charged Asp404) and the secondary amino group (hydrophobic Met341).
PDB,PDB,1,True,PMC11793806,"The crystal structures of the Nrf2/NFE2L2, VEGFR, ZNF24, and ATM proteins used for docking were obtained from the protein data bank (PDB), which is accessible at https://www.rcsb.org/."
PDB,PDB,1,True,PMC11793806,"The PDB IDs for the 4 proteins are 7X5E 1FLT, 3LHR, and 7SIC, respectively."
PDB,PDB,1,True,PMC11793806,"Acknowledgments: We thank the providers of the protein structures in the PDB database (Sengoku et al 28 , Wiesmann et al 27 , Volkman et al., and Warren et al 30 ), and to the providers of the microarray of PAH in the GEO database (Mura et al 16 )."
PDB,PDB,1,True,PMC11873931,"12 Here, we systematically survey and compare the structural mechanism of ligands bound to helicases in the Protein Data Bank (PDB) to gain insight into the structural chemistry of enzyme inhibition and inform future efforts in helicase drug design."
PDB,PDB,1,True,PMC11841048,"7 − 14 The structural determinants for the selectivity for bacterial over mammalian IMPDHs are revealed in the many E·IMP·I crystal structures of IMPDHs from Bacillus anthracis ( Ba ), Campylobacter jejuni ( Cj ), Cryptosporidium parvum ( Cp ), Clostridium perfringens ( Clp ), and Mycobacterium tuberculosis ( Mtb ) deposited in the Protein Data Bank (PDB)."
PDB,PDB,1,True,PMC11989890,"Therefore, we included receptor tyrosine kinases EGFR (PDB: 1M17, 4HJO, 1XKK), VEGFR (PDB: 4AGD, 4ASD, 3EWH), HER2 (PDB: 3RCD, 3PPO), non-receptor tyrosine kinases SCR (PDB: 1A07, 3F3V), ACK-1 (PDB: 5ZXB), and serine/threonine protein kinases (STPKs) BRAF (PDB: 4RZV, 7MOU), MEK (PDB: 4U7Z, 7MOY), and CDK5 (PDB: 1UNL) that are frequently overactivated or mutated in these cancer types."
PDB,PDB,1,True,PMC11989890,"The structures of target proteins EGFR (PDB: 1M17, 4HJO, 1XKK), VEGFR (PDB: 4AGD, 4ASD, 3EWH), HER2 (PDB: 3RCD, 3PPO), BRAF (PDB: 4RZV, 7MOU), MEK (PDB: 4U7Z, 7MOY), SCR (PDB: 1A07, 3F3V), and CDK5 (PDB: 1UNL) were retrieved from the Protein Data Bank (PDB) [ 72 ]."
PDB,PDB,1,True,PMC11989890,"The target proteins were prepared using the Protein Preparation Wizard [ 73 ], involving removal of water molecules that do not form hydrogen bonds, completion of absent loops from the PDB file, and addition of hydrogen atoms absent in the structure of target protein."
PDB,PDB,1,True,PMC11923696,34 − 36 The three-dimensional (3D) structures from PubChem were used to prepare the ligands and the Open Babel GUI (Graphical user interface) was used to convert them to the Protein Data bank (PDB) format.
PDB,PDB,1,True,PMC11923696,"37 Auto Dock version 4.2 was used for protein (PDB ID: 3EWH ) that was downloaded from the Research Collaboratory for Structural Bioinformatics (RCSB) PDB optimization through the removal of water and other atoms, the addition of a polar hydrogen group, and then the assignment of Kollman energy."
